{
  "artifact_id": "gppo-world/T-00/baseline-contract/v0.1.0/none",
  "node_id": "T-00",
  "status": "absent",
  "source_commit": "22487f93740ddd1ef428bf0bd7c4f45f7cee27f7",
  "parent_artifact_id": null,
  "schema_version": "gppo-world-transition/0.1.0",
  "config_uri": "baseline-manifest.json",
  "config_sha256": "a70380c754ce85c1c7be43a7b0c0082df82122959a3b364fe1c1d0d352b1e4ae",
  "dataset_manifest_uri": "",
  "dataset_manifest_sha256": "",
  "seeds": [42, 42001],
  "checkpoint_uri": "",
  "checkpoint_sha256": "",
  "metrics_uri": "contract-test-report.md",
  "metrics_sha256": "",
  "environment": {
    "python": "3.14.4",
    "framework": "torch 2.13.0+cpu",
    "cuda": null,
    "hardware": "CPU"
  },
  "created_at": "2026-09-02T10:17:03+08:00",
  "notes": "T-00 creates no model checkpoint. Historical GPPO checkpoint binaries are absent; the upstream minimal PPO checkpoint roundtrip passed in a temporary directory."
}
